{
  "$schema": "http://json-schema.org/draft-07/schema#",
  "title": "SecurityGroup",
  "type": "object",
  "required": ["resource_type", "resource_id", "account_id", "account_name", "region"],
  "properties": {
    "resource_type":   { "type": "string", "const": "aws::ec2::security_group" },
    "resource_id":     { "type": "string" },
    "account_id":      { "type": "string" },
    "account_name":    { "type": "string" },
    "region":          { "type": "string" },
    "vpc_id":          { "type": "string" },
    "group_name":      { "type": "string" },
    "description":     { "type": "string" },
    "inbound_rules":   { "type": "array" },
    "outbound_rules":  { "type": "array" },
    "tags":            { "type": "object" },
    "relationships":   { "type": "array" },
    "collected_at":    { "type": "string", "format": "date-time" }
  }
}
