[
  {
    "resource_type": "aws::ec2::security_group",
    "resource_id": "sg-01f93b04ca8134004",
    "account_id": "396608799622",
    "account_name": "Portal-QA",
    "region": "eu-south-2",
    "vpc_id": "vpc-0943c2ad6ac2aeb29",
    "group_name": "itl-0003-portal-qa-lambda-sync-buk-absence-02-sg",
    "description": "SG Lambda itl-0003-portal-qa-lambda-sync-buk-absence-02 - egress a VPC endpoints y DNS",
    "inbound_rules": [],
    "outbound_rules": [
      {
        "protocol": "tcp",
        "from_port": 5432,
        "to_port": 5432,
        "ipv4_ranges": [
          "10.11.0.0/16"
        ],
        "ipv6_ranges": [],
        "referenced_group_ids": [],
        "prefix_list_ids": []
      },
      {
        "protocol": "tcp",
        "from_port": 53,
        "to_port": 53,
        "ipv4_ranges": [
          "10.11.0.0/16"
        ],
        "ipv6_ranges": [],
        "referenced_group_ids": [],
        "prefix_list_ids": []
      },
      {
        "protocol": "udp",
        "from_port": 53,
        "to_port": 53,
        "ipv4_ranges": [
          "10.11.0.0/16"
        ],
        "ipv6_ranges": [],
        "referenced_group_ids": [],
        "prefix_list_ids": []
      },
      {
        "protocol": "tcp",
        "from_port": 443,
        "to_port": 443,
        "ipv4_ranges": [
          "0.0.0.0/0"
        ],
        "ipv6_ranges": [],
        "referenced_group_ids": [
          "sg-0fc6e97ba70eb0675"
        ],
        "prefix_list_ids": []
      }
    ],
    "tags": {
      "coid": "itl",
      "apid": "portal",
      "assetid": "0003",
      "Name": "itl-0003-portal-qa-lambda-sync-buk-absence-02-sg",
      "env": "qa"
    },
    "relationships": [
      {
        "resource_type": "aws::ec2::vpc",
        "resource_id": "vpc-0943c2ad6ac2aeb29",
        "relation": "belongs_to_vpc"
      }
    ],
    "collected_at": "2026-08-15T07:55:10.967561+00:00"
  },
  {
    "resource_type": "aws::ec2::security_group",
    "resource_id": "sg-0dcb9bdfef740cbf4",
    "account_id": "396608799622",
    "account_name": "Portal-QA",
    "region": "eu-south-2",
    "vpc_id": "vpc-0d2021cfeeaf34c89",
    "group_name": "default",
    "description": "default VPC security group",
    "inbound_rules": [
      {
        "protocol": "-1",
        "from_port": null,
        "to_port": null,
        "ipv4_ranges": [],
        "ipv6_ranges": [],
        "referenced_group_ids": [
          "sg-0dcb9bdfef740cbf4"
        ],
        "prefix_list_ids": []
      }
    ],
    "outbound_rules": [
      {
        "protocol": "-1",
        "from_port": null,
        "to_port": null,
        "ipv4_ranges": [
          "0.0.0.0/0"
        ],
        "ipv6_ranges": [],
        "referenced_group_ids": [],
        "prefix_list_ids": []
      }
    ],
    "tags": {},
    "relationships": [
      {
        "resource_type": "aws::ec2::vpc",
        "resource_id": "vpc-0d2021cfeeaf34c89",
        "relation": "belongs_to_vpc"
      }
    ],
    "collected_at": "2026-08-15T07:55:10.967590+00:00"
  },
  {
    "resource_type": "aws::ec2::security_group",
    "resource_id": "sg-0e2fbe135b75b6004",
    "account_id": "396608799622",
    "account_name": "Portal-QA",
    "region": "eu-south-2",
    "vpc_id": "vpc-0943c2ad6ac2aeb29",
    "group_name": "itl-0003-portal-qa-dashboard-github-runner-sg-0220260210222708980400000001",
    "description": "Managed by Terraform",
    "inbound_rules": [
      {
        "protocol": "-1",
        "from_port": null,
        "to_port": null,
        "ipv4_ranges": [
          "0.0.0.0/0"
        ],
        "ipv6_ranges": [],
        "referenced_group_ids": [],
        "prefix_list_ids": []
      },
      {
        "protocol": "tcp",
        "from_port": 22,
        "to_port": 22,
        "ipv4_ranges": [],
        "ipv6_ranges": [],
        "referenced_group_ids": [
          "sg-0aa6d55bd394447f6"
        ],
        "prefix_list_ids": []
      },
      {
        "protocol": "tcp",
        "from_port": 443,
        "to_port": 443,
        "ipv4_ranges": [
          "0.0.0.0/0"
        ],
        "ipv6_ranges": [],
        "referenced_group_ids": [],
        "prefix_list_ids": []
      }
    ],
    "outbound_rules": [
      {
        "protocol": "-1",
        "from_port": null,
        "to_port": null,
        "ipv4_ranges": [
          "0.0.0.0/0"
        ],
        "ipv6_ranges": [],
        "referenced_group_ids": [],
        "prefix_list_ids": []
      }
    ],
    "tags": {
      "assetid": "0003",
      "apid": "portal",
      "env": "qa",
      "coid": "itl",
      "Name": "itl-0003-portal-qa-dashboard-github-runner-sg-02"
    },
    "relationships": [
      {
        "resource_type": "aws::ec2::vpc",
        "resource_id": "vpc-0943c2ad6ac2aeb29",
        "relation": "belongs_to_vpc"
      }
    ],
    "collected_at": "2026-08-15T07:55:10.967606+00:00"
  },
  {
    "resource_type": "aws::ec2::security_group",
    "resource_id": "sg-0bde8c4d96d2ee756",
    "account_id": "396608799622",
    "account_name": "Portal-QA",
    "region": "eu-south-2",
    "vpc_id": "vpc-0943c2ad6ac2aeb29",
    "group_name": "itl-0003-portal-qa-resolver-route53-02-sg",
    "description": "itl-0003-portal-qa-resolver-route53-02-sg",
    "inbound_rules": [
      {
        "protocol": "udp",
        "from_port": 53,
        "to_port": 53,
        "ipv4_ranges": [
          "10.18.3.147/32"
        ],
        "ipv6_ranges": [],
        "referenced_group_ids": [],
        "prefix_list_ids": []
      },
      {
        "protocol": "tcp",
        "from_port": 53,
        "to_port": 53,
        "ipv4_ranges": [
          "10.18.3.147/32"
        ],
        "ipv6_ranges": [],
        "referenced_group_ids": [],
        "prefix_list_ids": []
      }
    ],
    "outbound_rules": [
      {
        "protocol": "-1",
        "from_port": null,
        "to_port": null,
        "ipv4_ranges": [
          "0.0.0.0/0"
        ],
        "ipv6_ranges": [],
        "referenced_group_ids": [],
        "prefix_list_ids": []
      }
    ],
    "tags": {},
    "relationships": [
      {
        "resource_type": "aws::ec2::vpc",
        "resource_id": "vpc-0943c2ad6ac2aeb29",
        "relation": "belongs_to_vpc"
      }
    ],
    "collected_at": "2026-08-15T07:55:10.967616+00:00"
  },
  {
    "resource_type": "aws::ec2::security_group",
    "resource_id": "sg-0b44d41457c601672",
    "account_id": "396608799622",
    "account_name": "Portal-QA",
    "region": "eu-south-2",
    "vpc_id": "vpc-0943c2ad6ac2aeb29",
    "group_name": "k8s-intelicaqaapps-c6d8532287",
    "description": "[k8s] Managed SecurityGroup for LoadBalancer",
    "inbound_rules": [
      {
        "protocol": "tcp",
        "from_port": 443,
        "to_port": 443,
        "ipv4_ranges": [
          "0.0.0.0/0"
        ],
        "ipv6_ranges": [],
        "referenced_group_ids": [],
        "prefix_list_ids": []
      }
    ],
    "outbound_rules": [
      {
        "protocol": "-1",
        "from_port": null,
        "to_port": null,
        "ipv4_ranges": [
          "0.0.0.0/0"
        ],
        "ipv6_ranges": [],
        "referenced_group_ids": [],
        "prefix_list_ids": []
      }
    ],
    "tags": {
      "elbv2.k8s.aws/cluster": "itl-0003-portal-qa-eks-apps-02",
      "env": "qa",
      "ingress.k8s.aws/stack": "intelica-qa-apps",
      "apid": "portal",
      "Name": "itl-0003-portal-qa-alb-apps-02-sg",
      "coid": "itl",
      "ingress.k8s.aws/resource": "ManagedLBSecurityGroup",
      "assetid": "0003"
    },
    "relationships": [
      {
        "resource_type": "aws::ec2::vpc",
        "resource_id": "vpc-0943c2ad6ac2aeb29",
        "relation": "belongs_to_vpc"
      }
    ],
    "collected_at": "2026-08-15T07:55:10.967628+00:00"
  },
  {
    "resource_type": "aws::ec2::security_group",
    "resource_id": "sg-0e142ef07b7423ede",
    "account_id": "396608799622",
    "account_name": "Portal-QA",
    "region": "eu-south-2",
    "vpc_id": "vpc-0943c2ad6ac2aeb29",
    "group_name": "itl-0003-portal-qa-lambda-pg-audit-02-sg",
    "description": "Security group for pg-audit Lambda function",
    "inbound_rules": [],
    "outbound_rules": [
      {
        "protocol": "tcp",
        "from_port": 53,
        "to_port": 53,
        "ipv4_ranges": [
          "10.11.0.0/16"
        ],
        "ipv6_ranges": [],
        "referenced_group_ids": [],
        "prefix_list_ids": []
      },
      {
        "protocol": "udp",
        "from_port": 53,
        "to_port": 53,
        "ipv4_ranges": [
          "10.11.0.0/16"
        ],
        "ipv6_ranges": [],
        "referenced_group_ids": [],
        "prefix_list_ids": []
      },
      {
        "protocol": "tcp",
        "from_port": 443,
        "to_port": 443,
        "ipv4_ranges": [],
        "ipv6_ranges": [],
        "referenced_group_ids": [
          "sg-0fc6e97ba70eb0675",
          "sg-00511ceb16d35e82b"
        ],
        "prefix_list_ids": [
          "pl-64a5400d"
        ]
      }
    ],
    "tags": {
      "coid": "itl",
      "apid": "portal",
      "Name": "itl-0003-portal-qa-lambda-pg-audit-02-sg",
      "env": "qa",
      "assetid": "0003"
    },
    "relationships": [
      {
        "resource_type": "aws::ec2::vpc",
        "resource_id": "vpc-0943c2ad6ac2aeb29",
        "relation": "belongs_to_vpc"
      }
    ],
    "collected_at": "2026-08-15T07:55:10.967641+00:00"
  },
  {
    "resource_type": "aws::ec2::security_group",
    "resource_id": "sg-076cc56f6b3e12257",
    "account_id": "396608799622",
    "account_name": "Portal-QA",
    "region": "eu-south-2",
    "vpc_id": "vpc-0943c2ad6ac2aeb29",
    "group_name": "itl-0003-portal-qa-ec2-apps-02-sg",
    "description": "EKS node shared security group",
    "inbound_rules": [
      {
        "protocol": "tcp",
        "from_port": 6443,
        "to_port": 6443,
        "ipv4_ranges": [],
        "ipv6_ranges": [],
        "referenced_group_ids": [
          "sg-0fe8427e932343e9e"
        ],
        "prefix_list_ids": []
      },
      {